{
  "drug": {
    "name": "Korlym",
    "therapeutic_class": "metabolic"
  },
  "source": {
    "payer": "alaska_medicaid",
    "list": "Korlym Criteria",
    "effective_date": "1970-01-01",
    "citation": "https://health.alaska.gov/media/2hwgnaft/korlym-pa.pdf",
    "criteria_pdf": "data/alaska/raw/korlym-pa.pdf"
  },
  "requires_pa": true,
  "pdl_status": "unknown",
  "encoding_status": "text_only",
  "criteria": [],
  "alternatives": [],
  "notes": [
    "Criteria PDF archived and text extracted; predicate encoding pending. evaluate() must not auto-pass \u2014 returns need_info / encoding_incomplete."
  ],
  "inferred_required_facts": [
    "indication"
  ]
}
