{
  "drug": {
    "name": "Amitiza",
    "generic_name": "lubiprostone",
    "therapeutic_class": "gastrointestinal"
  },
  "source": {
    "payer": "alaska_medicaid",
    "list": "Amitiza Criteria",
    "effective_date": "2019-06-10",
    "citation": "https://health.alaska.gov/media/lwcnvd3j/amitiza_and_linzess_pa.pdf",
    "criteria_pdf": "data/alaska/raw/amitiza_and_linzess_pa.pdf"
  },
  "requires_pa": true,
  "pdl_status": "unknown",
  "encoding_status": "text_only",
  "criteria": [],
  "alternatives": [],
  "notes": [
    "Criteria PDF archived and text extracted; predicate encoding pending. evaluate() must not auto-pass \u2014 returns need_info / encoding_incomplete."
  ],
  "inferred_required_facts": [
    "age_years",
    "indication",
    "prior_therapy_failures"
  ]
}
