{
  "drug": {
    "name": "Imbruvica",
    "generic_name": "ibrutinib",
    "therapeutic_class": "other"
  },
  "source": {
    "payer": "alaska_medicaid",
    "list": "Imbruvica Criteria",
    "effective_date": "2022-05-01",
    "citation": "https://health.alaska.gov/media/ig1dbw55/imbruvica.pdf",
    "criteria_pdf": "data/alaska/raw/imbruvica.pdf"
  },
  "requires_pa": true,
  "pdl_status": "unknown",
  "encoding_status": "text_only",
  "criteria": [],
  "alternatives": [],
  "notes": [
    "Criteria PDF archived and text extracted; predicate encoding pending. evaluate() must not auto-pass \u2014 returns need_info / encoding_incomplete."
  ],
  "inferred_required_facts": [
    "indication"
  ]
}
