{
  "drug": {
    "name": "Vumerity",
    "therapeutic_class": "other"
  },
  "source": {
    "payer": "alaska_medicaid",
    "list": "Vumerity Criteria",
    "effective_date": "2020-03-16",
    "citation": "https://health.alaska.gov/media/2orjoxli/202001-vumerity_criteria_2019.pdf",
    "criteria_pdf": "data/alaska/raw/202001-vumerity_criteria_2019.pdf"
  },
  "requires_pa": true,
  "pdl_status": "unknown",
  "encoding_status": "text_only",
  "criteria": [],
  "alternatives": [],
  "notes": [
    "Criteria PDF archived and text extracted; predicate encoding pending. evaluate() must not auto-pass \u2014 returns need_info / encoding_incomplete."
  ],
  "inferred_required_facts": [
    "age_years",
    "indication",
    "prescriber_specialty"
  ]
}
