{
  "drug": {
    "name": "Yorvipath",
    "therapeutic_class": "other"
  },
  "source": {
    "payer": "alaska_medicaid",
    "list": "Yorvipath Criteria",
    "effective_date": "2026-06-01",
    "citation": "https://health.alaska.gov/media/zl5lhrqn/yorvipath_criteria_2026.pdf",
    "criteria_pdf": "data/alaska/raw/yorvipath_criteria_2026.pdf"
  },
  "requires_pa": true,
  "pdl_status": "unknown",
  "encoding_status": "text_only",
  "criteria": [],
  "alternatives": [],
  "notes": [
    "Criteria PDF archived and text extracted; predicate encoding pending. evaluate() must not auto-pass \u2014 returns need_info / encoding_incomplete."
  ],
  "inferred_required_facts": [
    "age_years",
    "indication",
    "prescriber_specialty",
    "prior_therapy_failures"
  ]
}
