{
  "drug": {
    "name": "Bactroban Cream",
    "generic_name": "mupirocin cream",
    "therapeutic_class": "infectious-disease"
  },
  "source": {
    "payer": "alaska_medicaid",
    "list": "Bactroban Cream Criteria",
    "effective_date": "2011-04-15",
    "citation": "https://health.alaska.gov/media/phhat5b0/bactroban-cream.pdf",
    "criteria_pdf": "data/alaska/raw/bactroban-cream.pdf"
  },
  "requires_pa": true,
  "pdl_status": "unknown",
  "encoding_status": "partial",
  "criteria": [
    {
      "id": "indication",
      "text": "Patient is being treated for an infection suspected to be S. aureus or S. pyogenes susceptible to mupirocin.",
      "citation": "https://health.alaska.gov/media/phhat5b0/bactroban-cream.pdf",
      "required_facts": [
        "indication"
      ],
      "predicate": {
        "op": "in",
        "fact": "indication",
        "values": [
          "secondarily_infected_traumatic_skin_lesion_s_aureus_or_s_pyogenes"
        ]
      }
    },
    {
      "id": "unable_to_use_mupirocin_ointment_inactive_allergy",
      "text": "Patient is unable to use mupirocin 2% ointment due to a documented allergy to one or more inactive ingredients present in the ointment formulation that are absent in the cream.",
      "citation": "https://health.alaska.gov/media/phhat5b0/bactroban-cream.pdf",
      "required_facts": [
        "unable_to_use_mupirocin_ointment_inactive_allergy"
      ],
      "predicate": {
        "op": "eq",
        "fact": "unable_to_use_mupirocin_ointment_inactive_allergy",
        "value": true
      }
    }
  ],
  "alternatives": [],
  "notes": [
    "Partial encoding of Alaska Medicaid Bactroban Cream (mupirocin cream) Criteria Version 1; Last updated 3/21/2011; Approved 4/15/2011; Reviewed 09/19/2014 (format & reference update). Stub effective_date 1970-01-01 replaced with approval date 2011-04-15.",
    "FDA indication (notes only): treatment of secondarily infected traumatic skin lesions (up to 10 cm in length or 100 cm² in area) due to susceptible strains of S. aureus and S. pyogenes.",
    "Denial criterion (encoded via the ointment-allergy gate): patient does not have a documented allergy to one or more inactive ingredients present in the ointment formulation.",
    "Reference: Bactroban cream package insert, GlaxoSmithKline, May 2014."
  ],
  "fact_ui": {
    "indication": {
      "type": "select",
      "label": "Treatment indication",
      "options": [
        {
          "value": "secondarily_infected_traumatic_skin_lesion_s_aureus_or_s_pyogenes",
          "label": "Secondarily infected traumatic skin lesion due to susceptible S. aureus or S. pyogenes"
        }
      ]
    },
    "unable_to_use_mupirocin_ointment_inactive_allergy": {
      "type": "select",
      "label": "Unable to use mupirocin 2% ointment due to documented allergy to ointment-only inactive ingredient(s)",
      "options": [
        {
          "value": "yes",
          "label": "Yes"
        },
        {
          "value": "no",
          "label": "No"
        }
      ]
    }
  }
}
