{
  "drug": {
    "name": "Sphingosine 1-phosphate receptor",
    "therapeutic_class": "other"
  },
  "source": {
    "payer": "alaska_medicaid",
    "list": "Sphingosine 1-phosphate receptor Criteria",
    "effective_date": "2024-03-01",
    "citation": "https://health.alaska.gov/media/3tnnipdv/sphingosine-1-phosphate-receptor-modulator-ms-_criteria_update_2024.pdf",
    "criteria_pdf": "data/alaska/raw/sphingosine-1-phosphate-receptor-modulator-ms-_criteria_update_2024.pdf"
  },
  "requires_pa": true,
  "pdl_status": "unknown",
  "encoding_status": "text_only",
  "criteria": [],
  "alternatives": [],
  "notes": [
    "Criteria PDF archived and text extracted; predicate encoding pending. evaluate() must not auto-pass \u2014 returns need_info / encoding_incomplete."
  ],
  "inferred_required_facts": [
    "age_years",
    "indication",
    "prescriber_specialty"
  ]
}
